{
 "id": "betterpalegarden_haunted_house",
 "source": "github",
 "source_url": "https://github.com/JimiIT92/BetterPaleGarden/blob/master/src/main/resources/data/betterpalegarden/structure/haunted_house.nbt",
 "license": "MIT",
 "title": "Pale Garden Haunted House",
 "tags": {
  "category": "residential",
  "style": [
   "gothic",
   "fantasy",
   "medieval"
  ],
  "size_bucket": "medium"
 },
 "bounding_box": {
  "size": [
   12,
   10,
   11
  ]
 },
 "block_palette": {
  "0": "minecraft:pale_oak_planks",
  "1": "minecraft:grass_block[snowy=false]",
  "2": "minecraft:pale_oak_slab[type=bottom,waterlogged=false]",
  "3": "minecraft:pale_oak_stairs[facing=north,half=bottom,shape=straight,waterlogged=false]",
  "4": "minecraft:pale_oak_stairs[facing=south,half=bottom,shape=straight,waterlogged=false]",
  "5": "minecraft:pale_hanging_moss[tip=true]",
  "6": "minecraft:pale_hanging_moss[tip=false]",
  "7": "minecraft:dead_bush",
  "8": "minecraft:cobweb",
  "9": "minecraft:pale_oak_fence[east=false,north=true,south=true,waterlogged=false,west=false]",
  "10": "minecraft:pale_oak_log[axis=y]",
  "11": "minecraft:dirt",
  "12": "minecraft:soul_lantern[hanging=true,waterlogged=false]",
  "13": "minecraft:pale_oak_fence[east=true,north=false,south=false,waterlogged=false,west=true]",
  "14": "minecraft:pale_oak_stairs[facing=east,half=bottom,shape=straight,waterlogged=false]",
  "15": "minecraft:pale_oak_stairs[facing=west,half=bottom,shape=straight,waterlogged=false]",
  "16": "minecraft:pale_moss_carpet[bottom=true,east=none,north=none,south=none,west=none]",
  "17": "minecraft:pale_oak_fence[east=false,north=false,south=false,waterlogged=false,west=true]",
  "18": "minecraft:pale_oak_fence[east=false,north=false,south=true,waterlogged=false,west=false]",
  "19": "minecraft:pale_oak_fence[east=false,north=true,south=false,waterlogged=false,west=false]",
  "20": "minecraft:pale_oak_fence[east=true,north=false,south=false,waterlogged=false,west=false]",
  "21": "minecraft:gray_carpet",
  "22": "minecraft:pale_oak_trapdoor[facing=west,half=top,open=true,powered=false,waterlogged=false]",
  "23": "minecraft:pale_moss_carpet[bottom=true,east=low,north=low,south=none,west=none]",
  "24": "minecraft:pale_moss_carpet[bottom=true,east=none,north=none,south=none,west=low]",
  "25": "minecraft:pale_moss_carpet[bottom=false,east=none,north=none,south=low,west=none]",
  "26": "minecraft:pale_moss_carpet[bottom=true,east=none,north=low,south=none,west=low]",
  "27": "minecraft:pale_moss_carpet[bottom=true,east=none,north=none,south=low,west=none]",
  "28": "minecraft:grass",
  "29": "minecraft:pale_moss_carpet[bottom=false,east=none,north=low,south=none,west=none]",
  "30": "minecraft:pale_moss_carpet[bottom=false,east=none,north=none,south=none,west=low]",
  "31": "minecraft:pale_moss_carpet[bottom=true,east=low,north=none,south=none,west=none]",
  "32": "minecraft:pale_moss_carpet[bottom=true,east=none,north=none,south=tall,west=none]",
  "33": "minecraft:pale_moss_carpet[bottom=true,east=none,north=tall,south=none,west=none]",
  "34": "minecraft:pale_oak_wood[axis=y]",
  "35": "minecraft:spawner",
  "36": "minecraft:chest[facing=east,type=single,waterlogged=false]",
  "37": "minecraft:chest[facing=north,type=single,waterlogged=false]",
  "38": "minecraft:crafting_table",
  "39": "minecraft:flower_pot",
  "40": "minecraft:furnace[facing=south,lit=false]",
  "41": "minecraft:light_gray_bed[facing=east,occupied=false,part=foot]",
  "42": "minecraft:light_gray_bed[facing=east,occupied=false,part=head]",
  "43": "minecraft:pale_moss_carpet[bottom=true,east=low,north=none,south=low,west=none]",
  "44": "minecraft:pale_moss_carpet[bottom=true,east=low,north=none,south=tall,west=none]",
  "45": "minecraft:pale_moss_carpet[bottom=true,east=none,north=low,south=none,west=none]",
  "46": "minecraft:pale_moss_carpet[bottom=true,east=none,north=none,south=low,west=low]",
  "47": "minecraft:pale_moss_carpet[bottom=true,east=none,north=none,south=low,west=tall]",
  "48": "minecraft:pale_moss_carpet[bottom=true,east=none,north=none,south=none,west=tall]",
  "49": "minecraft:pale_oak_door[facing=east,half=lower,hinge=right,open=false,powered=false]",
  "50": "minecraft:pale_oak_door[facing=east,half=upper,hinge=right,open=false,powered=false]",
  "51": "minecraft:pale_oak_fence[east=false,north=false,south=false,waterlogged=false,west=false]",
  "52": "minecraft:pale_oak_pressure_plate[powered=false]",
  "53": "minecraft:pale_oak_stairs[facing=north,half=bottom,shape=outer_right,waterlogged=false]",
  "54": "minecraft:pale_oak_stairs[facing=south,half=bottom,shape=outer_left,waterlogged=false]",
  "55": "minecraft:pale_oak_stairs[facing=south,half=bottom,shape=outer_right,waterlogged=false]",
  "56": "minecraft:pale_oak_stairs[facing=west,half=bottom,shape=outer_right,waterlogged=false]",
  "57": "minecraft:pale_oak_trapdoor[facing=north,half=top,open=true,powered=false,waterlogged=false]",
  "58": "minecraft:pale_oak_trapdoor[facing=south,half=top,open=true,powered=false,waterlogged=false]",
  "59": "minecraft:potted_pale_oak_sapling"
 },
 "voxels": [
  [
   0,
   0,
   0,
   1
  ],
  [
   0,
   0,
   1,
   1
  ],
  [
   0,
   0,
   2,
   1
  ],
  [
   0,
   0,
   3,
   1
  ],
  [
   0,
   0,
   4,
   1
  ],
  [
   0,
   0,
   5,
   1
  ],
  [
   0,
   0,
   6,
   1
  ],
  [
   0,
   0,
   7,
   1
  ],
  [
   0,
   0,
   8,
   1
  ],
  [
   0,
   0,
   9,
   1
  ],
  [
   0,
   0,
   10,
   1
  ],
  [
   1,
   0,
   0,
   1
  ],
  [
   1,
   0,
   1,
   11
  ],
  [
   1,
   0,
   2,
   11
  ],
  [
   1,
   0,
   3,
   11
  ],
  [
   1,
   0,
   4,
   1
  ],
  [
   1,
   0,
   5,
   1
  ],
  [
   1,
   0,
   6,
   1
  ],
  [
   1,
   0,
   7,
   11
  ],
  [
   1,
   0,
   8,
   11
  ],
  [
   1,
   0,
   9,
   11
  ],
  [
   1,
   0,
   10,
   1
  ],
  [
   2,
   0,
   0,
   11
  ],
  [
   2,
   0,
   1,
   0
  ],
  [
   2,
   0,
   2,
   0
  ],
  [
   2,
   0,
   3,
   0
  ],
  [
   2,
   0,
   4,
   0
  ],
  [
   2,
   0,
   5,
   0
  ],
  [
   2,
   0,
   6,
   0
  ],
  [
   2,
   0,
   7,
   0
  ],
  [
   2,
   0,
   8,
   0
  ],
  [
   2,
   0,
   9,
   0
  ],
  [
   2,
   0,
   10,
   11
  ],
  [
   3,
   0,
   0,
   1
  ],
  [
   3,
   0,
   1,
   0
  ],
  [
   3,
   0,
   2,
   0
  ],
  [
   3,
   0,
   3,
   0
  ],
  [
   3,
   0,
   4,
   0
  ],
  [
   3,
   0,
   5,
   0
  ],
  [
   3,
   0,
   6,
   0
  ],
  [
   3,
   0,
   7,
   0
  ],
  [
   3,
   0,
   8,
   0
  ],
  [
   3,
   0,
   9,
   0
  ],
  [
   3,
   0,
   10,
   1
  ],
  [
   4,
   0,
   0,
   1
  ],
  [
   4,
   0,
   1,
   0
  ],
  [
   4,
   0,
   2,
   0
  ],
  [
   4,
   0,
   3,
   0
  ],
  [
   4,
   0,
   4,
   0
  ],
  [
   4,
   0,
   5,
   0
  ],
  [
   4,
   0,
   6,
   0
  ],
  [
   4,
   0,
   7,
   0
  ],
  [
   4,
   0,
   8,
   0
  ],
  [
   4,
   0,
   9,
   0
  ],
  [
   4,
   0,
   10,
   1
  ],
  [
   5,
   0,
   0,
   1
  ],
  [
   5,
   0,
   1,
   0
  ],
  [
   5,
   0,
   2,
   0
  ],
  [
   5,
   0,
   3,
   0
  ],
  [
   5,
   0,
   4,
   0
  ],
  [
   5,
   0,
   5,
   0
  ],
  [
   5,
   0,
   6,
   0
  ],
  [
   5,
   0,
   7,
   0
  ],
  [
   5,
   0,
   8,
   0
  ],
  [
   5,
   0,
   9,
   0
  ],
  [
   5,
   0,
   10,
   1
  ],
  [
   6,
   0,
   0,
   1
  ],
  [
   6,
   0,
   1,
   0
  ],
  [
   6,
   0,
   2,
   0
  ],
  [
   6,
   0,
   3,
   0
  ],
  [
   6,
   0,
   4,
   0
  ],
  [
   6,
   0,
   5,
   0
  ],
  [
   6,
   0,
   6,
   0
  ],
  [
   6,
   0,
   7,
   0
  ],
  [
   6,
   0,
   8,
   0
  ],
  [
   6,
   0,
   9,
   0
  ],
  [
   6,
   0,
   10,
   1
  ],
  [
   7,
   0,
   0,
   1
  ],
  [
   7,
   0,
   1,
   0
  ],
  [
   7,
   0,
   2,
   0
  ],
  [
   7,
   0,
   3,
   0
  ],
  [
   7,
   0,
   4,
   0
  ],
  [
   7,
   0,
   5,
   0
  ],
  [
   7,
   0,
   6,
   0
  ],
  [
   7,
   0,
   7,
   0
  ],
  [
   7,
   0,
   8,
   0
  ],
  [
   7,
   0,
   9,
   0
  ],
  [
   7,
   0,
   10,
   1
  ],
  [
   8,
   0,
   0,
   1
  ],
  [
   8,
   0,
   1,
   0
  ],
  [
   8,
   0,
   2,
   0
  ],
  [
   8,
   0,
   3,
   0
  ],
  [
   8,
   0,
   4,
   0
  ],
  [
   8,
   0,
   5,
   0
  ],
  [
   8,
   0,
   6,
   0
  ],
  [
   8,
   0,
   7,
   0
  ],
  [
   8,
   0,
   8,
   0
  ],
  [
   8,
   0,
   9,
   0
  ],
  [
   8,
   0,
   10,
   1
  ],
  [
   9,
   0,
   0,
   1
  ],
  [
   9,
   0,
   1,
   0
  ],
  [
   9,
   0,
   2,
   0
  ],
  [
   9,
   0,
   3,
   0
  ],
  [
   9,
   0,
   4,
   0
  ],
  [
   9,
   0,
   5,
   0
  ],
  [
   9,
   0,
   6,
   0
  ],
  [
   9,
   0,
   7,
   0
  ],
  [
   9,
   0,
   8,
   0
  ],
  [
   9,
   0,
   9,
   0
  ],
  [
   9,
   0,
   10,
   1
  ],
  [
   10,
   0,
   0,
   11
  ],
  [
   10,
   0,
   1,
   0
  ],
  [
   10,
   0,
   2,
   0
  ],
  [
   10,
   0,
   3,
   0
  ],
  [
   10,
   0,
   4,
   0
  ],
  [
   10,
   0,
   5,
   0
  ],
  [
   10,
   0,
   6,
   0
  ],
  [
   10,
   0,
   7,
   0
  ],
  [
   10,
   0,
   8,
   0
  ],
  [
   10,
   0,
   9,
   0
  ],
  [
   10,
   0,
   10,
   11
  ],
  [
   11,
   0,
   0,
   1
  ],
  [
   11,
   0,
   1,
   11
  ],
  [
   11,
   0,
   2,
   1
  ],
  [
   11,
   0,
   3,
   1
  ],
  [
   11,
   0,
   4,
   1
  ],
  [
   11,
   0,
   5,
   1
  ],
  [
   11,
   0,
   6,
   1
  ],
  [
   11,
   0,
   7,
   1
  ],
  [
   11,
   0,
   8,
   1
  ],
  [
   11,
   0,
   9,
   11
  ],
  [
   11,
   0,
   10,
   1
  ],
  [
   1,
   1,
   1,
   0
  ],
  [
   1,
   1,
   2,
   1
  ],
  [
   1,
   1,
   3,
   1
  ],
  [
   1,
   1,
   7,
   1
  ],
  [
   1,
   1,
   8,
   1
  ],
  [
   1,
   1,
   9,
   0
  ],
  [
   2,
   1,
   0,
   0
  ],
  [
   2,
   1,
   1,
   10
  ],
  [
   2,
   1,
   2,
   0
  ],
  [
   2,
   1,
   3,
   0
  ],
  [
   2,
   1,
   4,
   0
  ],
  [
   2,
   1,
   6,
   0
  ],
  [
   2,
   1,
   7,
   0
  ],
  [
   2,
   1,
   8,
   0
  ],
  [
   2,
   1,
   9,
   10
  ],
  [
   2,
   1,
   10,
   0
  ],
  [
   3,
   1,
   1,
   0
  ],
  [
   3,
   1,
   2,
   38
  ],
  [
   3,
   1,
   9,
   0
  ],
  [